{
  "schema_version": 1,
  "id": "touchpulsar",
  "name": "TouchPulsar",
  "description": "A pulsar synthesizer for the Synthux Simple Touch, after Curtis Roads: formant pulse trains, masking, convolution and live input, played from the pads or via MIDI.",
  "author": { "name": "Petr Vlk", "url": "https://pulsar.imagiag.com" },
  "repo": "https://github.com/imagiag/TouchPulsar",
  "platform": "touch"
}
