{
  "schema_version": 1,
  "id": "degenerator",
  "name": "TouchDegenerator",
  "description": "A layered stereo looper for the Synthux Simple Touch 2 that lets you irreversibly degrade recorded material, inspired by Basinski's Disintegration Loops.",
  "author": { "name": "Joep Vermaat", "url": "https://codeberg.org/johantv" },
  "repo": "https://codeberg.org/johantv/Touch-Degenerator",
  "platform": "touch"
}
